{
  "consumer_contract_version": "1.0",
  "source_identity": {
    "analysis_id": "352903ee123e026d13541e286657d59ea95ed331a39970cc1c5ee98c7a0a3e43",
    "generation_id": "e29bfda3e4c5534368e35026987f7bc57e2ddcdd2b6aae2833126729a7aeaf48"
  },
  "meta": {
    "run_id": "352903ee123e026d13541e286657d59ea95ed331a39970cc1c5ee98c7a0a3e43",
    "source_commit": "570540590fb6a9ab4defc8dd6e9d292481bed2af",
    "source_snapshot": "output/generations/e29bfda3e4c5534368e35026987f7bc57e2ddcdd2b6aae2833126729a7aeaf48/archive.json",
    "source_sha256": "ecdca81f3cfe59f49970c95ba366c518f1fa8135714499910d37cf49f3186644",
    "generated_at": "2026-07-25T07:30:49.085005Z",
    "data_date": "2026-07-23",
    "valid_until": "2026-08-04T07:30:49.085005Z",
    "hard_stop_after": "2026-08-08T07:30:49.085005Z",
    "status": "success",
    "failure_reason": null,
    "global_quality": {
      "critical_missing": [],
      "warnings": [
        "OVERLAP:CEG",
        "OVERLAP:PLTR",
        "OVERLAP:VST"
      ]
    }
  },
  "user_view": {
    "presentation_version": "1.2",
    "analysis_mode": "initial_observation",
    "phases": [
      {
        "conclusion": "資源関連の株価が市場平均より強くなっています。",
        "investment_meaning": "市場全体の広がりを確認してから、新規調査の範囲を決めます。",
        "cautions": [
          "今回は初期観測のため、現在の強弱だけを評価しています。変化の判定にはあと1週分の履歴が必要です。",
          "実際の資金流入額は確認できません。"
        ],
        "next_checks": [
          "市場平均を上回る業種の数が次週も増えるか"
        ]
      },
      {
        "conclusion": "現在は「大型バリュー」が相対的に強い状態です。",
        "investment_meaning": "強いスタイルと逆方向の銘柄は、調査の優先度を下げます。",
        "cautions": [
          "ETFは傾向を示す代理指標で、個別企業の質を保証しません。"
        ],
        "next_checks": [
          "最近の強さが長めの傾向と一致するか"
        ]
      },
      {
        "conclusion": "強いセクターはエネルギー、ヘルスケア、金融です。固定テーマ外では運輸、石油・ガス開発。",
        "investment_meaning": "固定テーマとは別に、複数企業へ強さが広がる業種だけを後続調査へ渡します。",
        "cautions": [
          "単一企業だけの急騰や、構成企業が3社未満の業種は候補にしません。"
        ],
        "next_checks": [
          "新たに見つかった業種の構成企業が市場平均を上回り続けるか"
        ]
      },
      {
        "conclusion": "個別企業を調べる対象はサイバーセキュリティ、運輸、石油・ガス開発、防衛です。回復条件を監視する対象はAI半導体、ネットワーク・光通信、半導体製造装置です。長期材料はあるが、現在の株価は弱い対象は該当なしです。現在は避ける対象はバイオテクノロジー、住宅建設、インフラ建設、地方銀行、小売、AIソフトウェア・データ基盤、データセンター電力・インフラ、原子力・ウランです。",
        "investment_meaning": "条件を満たす対象が少ない週は、件数を埋めず現金余力と調査時間を温存します。",
        "cautions": [
          "政策や長期材料が良くても、現在の株価が弱い対象は自動的に昇格しません。"
        ],
        "next_checks": [
          "回復条件を監視する対象が50日移動平均線と市場平均比を回復するか"
        ]
      },
      {
        "conclusion": "個別企業の調査候補は次のとおりです。PANW（サイバーセキュリティ）は代表企業です。サイバーセキュリティの代表企業として中心的な強さを確認するためです。 最重要確認事項は「統合セキュリティ基盤への集約が新規契約と既存顧客単価を押し上げるか」。最大の反対材料は「値引き競争や販売期間の長期化で残存契約価値の伸びが鈍ること」。 ZS（サイバーセキュリティ）は広がり確認用企業です。サイバーセキュリティの別企業にも及ぶ上昇の広がりを確認するためです。 最重要確認事項は「需要が単一製品でなくクラウド・端末・ID管理へ広がっているか」。最大の反対材料は「大型案件が少数企業に集中し、同業他社の請求額が伸びないこと」。 UNP（運輸）は代表企業です。運輸の代表企業として中心的な強さを確認するためです。 最重要確認事項は「輸送量と運賃の改善が稼働率・営業利益率の上昇へ結び付くか」。最大の反対材料は「荷動き減少や人件費・燃料費上昇で価格改善が相殺されること」。 CSX（運輸）は広がり確認用企業です。運輸の別企業にも及ぶ上昇の広がりを確認するためです。 最重要確認事項は「鉄道・物流・小口配送の複数経路で荷動きが回復しているか」。最大の反対材料は「一つの輸送形態だけが強く、業界全体の取扱量が増えないこと」。 OXY（石油・ガス開発）は代表企業です。石油・ガス開発の代表企業として中心的な強さを確認するためです。 最重要確認事項は「生産量と実現価格が設備投資後の自由現金収支を維持できるか」。最大の反対材料は「商品価格下落やコスト上昇で株主還元の原資が減ること」。 COP（石油・ガス開発）は広がり確認用企業です。石油・ガス開発の別企業にも及ぶ上昇の広がりを確認するためです。 最重要確認事項は「生産効率と資本規律が複数の開発企業で確認できるか」。最大の反対材料は「一社の資産構成だけが有利で、同業の現金収支が弱いこと」。 LMT（防衛）は代表企業です。防衛の代表企業として中心的な強さを確認するためです。 最重要確認事項は「予算措置が受注残と量産契約へ転換し、採算も維持できるか」。最大の反対材料は「固定価格契約のコスト超過や調達遅延で利益率が低下すること」。 AVAV（防衛）は広がり確認用企業です。防衛の別企業にも及ぶ上昇の広がりを確認するためです。 最重要確認事項は「航空・ミサイル・電子戦など複数領域で受注が拡大しているか」。最大の反対材料は「特定プログラムだけに依存し、他領域の受注残が増えないこと」。",
        "investment_meaning": "1対象につき最大2社とし、代表企業と広がり確認用企業を分けて調べます。",
        "cautions": [
          "候補は売買推奨ではなく、決算・競争力・割高感を調べる入口です。"
        ],
        "next_checks": [
          "各社の最重要確認事項と反対材料を一次資料で確かめる"
        ]
      },
      {
        "conclusion": "今週は資源関連の株価が市場平均より強くなっています。個別企業を調べる対象はサイバーセキュリティ、運輸、石油・ガス開発、防衛、回復条件を監視する対象はAI半導体、ネットワーク・光通信、半導体製造装置、長期材料はあるが、現在の株価は弱い対象は該当なし、現在は避ける対象はバイオテクノロジー、住宅建設、インフラ建設、地方銀行、小売、AIソフトウェア・データ基盤、データセンター電力・インフラ、原子力・ウランです。",
        "investment_meaning": "個別企業はPANW（サイバーセキュリティ）は代表企業です。サイバーセキュリティの代表企業として中心的な強さを確認するためです。 最重要確認事項は「統合セキュリティ基盤への集約が新規契約と既存顧客単価を押し上げるか」。最大の反対材料は「値引き競争や販売期間の長期化で残存契約価値の伸びが鈍ること」。 ZS（サイバーセキュリティ）は広がり確認用企業です。サイバーセキュリティの別企業にも及ぶ上昇の広がりを確認するためです。 最重要確認事項は「需要が単一製品でなくクラウド・端末・ID管理へ広がっているか」。最大の反対材料は「大型案件が少数企業に集中し、同業他社の請求額が伸びないこと」。 UNP（運輸）は代表企業です。運輸の代表企業として中心的な強さを確認するためです。 最重要確認事項は「輸送量と運賃の改善が稼働率・営業利益率の上昇へ結び付くか」。最大の反対材料は「荷動き減少や人件費・燃料費上昇で価格改善が相殺されること」。 CSX（運輸）は広がり確認用企業です。運輸の別企業にも及ぶ上昇の広がりを確認するためです。 最重要確認事項は「鉄道・物流・小口配送の複数経路で荷動きが回復しているか」。最大の反対材料は「一つの輸送形態だけが強く、業界全体の取扱量が増えないこと」。 OXY（石油・ガス開発）は代表企業です。石油・ガス開発の代表企業として中心的な強さを確認するためです。 最重要確認事項は「生産量と実現価格が設備投資後の自由現金収支を維持できるか」。最大の反対材料は「商品価格下落やコスト上昇で株主還元の原資が減ること」。 COP（石油・ガス開発）は広がり確認用企業です。石油・ガス開発の別企業にも及ぶ上昇の広がりを確認するためです。 最重要確認事項は「生産効率と資本規律が複数の開発企業で確認できるか」。最大の反対材料は「一社の資産構成だけが有利で、同業の現金収支が弱いこと」。 LMT（防衛）は代表企業です。防衛の代表企業として中心的な強さを確認するためです。 最重要確認事項は「予算措置が受注残と量産契約へ転換し、採算も維持できるか」。最大の反対材料は「固定価格契約のコスト超過や調達遅延で利益率が低下すること」。 AVAV（防衛）は広がり確認用企業です。防衛の別企業にも及ぶ上昇の広がりを確認するためです。 最重要確認事項は「航空・ミサイル・電子戦など複数領域で受注が拡大しているか」。最大の反対材料は「特定プログラムだけに依存し、他領域の受注残が増えないこと」。から確認します。",
        "cautions": [
          "直接的な資金フロー、過去時点の時価総額、決算直前日程は取得できない場合があります。"
        ],
        "next_checks": [
          "市場の広がり、候補テーマの50日線上比率、企業業績の裏付けを次週確認します。"
        ]
      }
    ]
  }
}
